{
  "name": "selfie-happy-path",
  "captureType": "selfie",
  "steps": [
    { "emit": "noFace", "holdFrames": 10 },
    { "emit": "faceTooFar", "holdFrames": 15 },
    { "emit": "faceCentered", "holdFrames": 20 },
    { "emit": "satisfied" }
  ],
  "expected": {
    "screens": ["consent", "instructions", "capture", "preview", "processing"],
    "events": [
      "flow_started",
      "consent_captured",
      "selfie_captured",
      "job_submitted",
      "flow_completed"
    ],
    "terminal": "submitted"
  }
}
