{
  "name": "document-happy-path",
  "captureType": "document",
  "steps": [
    { "emit": "noDocument", "holdFrames": 10 },
    { "emit": "documentFound", "holdFrames": 30 },
    { "emit": "satisfied" }
  ],
  "expected": {
    "screens": ["consent", "instructions", "capture", "preview", "processing"],
    "events": [
      "flow_started",
      "consent_captured",
      "document_captured",
      "job_submitted",
      "flow_completed"
    ],
    "terminal": "submitted"
  }
}
